{
  "work_item_id": "wi-1",
  "goal_ref": "symbivela:goal:goal-1",
  "workspace_id": "ws-1",
  "repository": "repo-a",
  "state": "executing",
  "owner": {"kind": "agent", "ref": "agent:alice"},
  "coordination_plan_summary": {"version": 2, "objective": "Ship the coordination bridge"},
  "claim_count": 2,
  "open_finding_count": 1,
  "blocking_findings": [{"id": "f-1", "kind": "path_conflict", "severity": "blocking"}],
  "evidence_refs": ["tekmovela:evidence:abc"],
  "version": 7,
  "updated_at": "2026-10-23T05:59:58Z",
  "source_system": "coordivela",
  "source_ref": "evt_proj_abc"
}
